Review,Link
"La Chine publie des quotas d'importation de brut pour 2024, 60% de plus que l'année précédente - commerce",https://news.google.com./articles/CBMirgFodHRwczovL3d3dy56b25lYm91cnNlLmNvbS9jb3Vycy9tYXRpZXJlLXByZW1pZXJlL1dUSS0yMzU1NjM5L2FjdHVhbGl0ZS9MYS1DaGluZS1wdWJsaWUtZGVzLXF1b3Rhcy1kLWltcG9ydGF0aW9uLWRlLWJydXQtcG91ci0yMDI0LTYwLWRlLXBsdXMtcXVlLWwtYW5uZWUtcHJlY2VkZW50ZS00NTY1NTg1Ny_SAQA?hl=fr&gl=MA&ceid=MA%3Afr
Le Maroc prolonge sa campagne d'importation de blé de janvier à avril,https://news.google.com./articles/CBMiZ2h0dHBzOi8vbGVtYXRpbi5tYS9lY29ub21pZS9sZS1tYXJvYy1wcm9sb25nZS1zYS1jYW1wYWduZS1kaW1wb3J0YXRpb24tZGUtYmxlLWRlLWphbnZpZXItYS1hdnJpbC8yMDI3OTfSAWtodHRwczovL2xlbWF0aW4ubWEvZWNvbm9taWUvbGUtbWFyb2MtcHJvbG9uZ2Utc2EtY2FtcGFnbmUtZGltcG9ydGF0aW9uLWRlLWJsZS1kZS1qYW52aWVyLWEtYXZyaWwvMjAyNzk3L2FtcA?hl=fr&gl=MA&ceid=MA%3Afr
Les Suisses voteront pour interdire ou non l'importation de foie gras et de fourrure,https://news.google.com./articles/CBMilwFodHRwczovL3d3dy5iZm10di5jb20vZWNvbm9taWUvaW50ZXJuYXRpb25hbC9sZXMtc3Vpc3Nlcy12b3Rlcm9udC1wb3VyLWludGVyZGlycmUtb3Utbm9uLWwtaW1wb3J0YXRpb24tZGUtZm9pZS1ncmFzLWV0LWRlLWZvdXJydXJlX0FELTIwMjMxMjI4MDU2OS5odG1s0gGbAWh0dHBzOi8vd3d3LmJmbXR2LmNvbS9hbXAvZWNvbm9taWUvaW50ZXJuYXRpb25hbC9sZXMtc3Vpc3Nlcy12b3Rlcm9udC1wb3VyLWludGVyZGlycmUtb3Utbm9uLWwtaW1wb3J0YXRpb24tZGUtZm9pZS1ncmFzLWV0LWRlLWZvdXJydXJlX0FELTIwMjMxMjI4MDU2OS5odG1s?hl=fr&gl=MA&ceid=MA%3Afr
"PLF-2024: réduire les droits d'importation sur les produits de consommation, maître mot des amendements",https://news.google.com./articles/CBMifGh0dHBzOi8vd3d3LmgyNGluZm8ubWEvcGxmLTIwMjQtcmVkdWlyZS1sZXMtZHJvaXRzLWRpbXBvcnRhdGlvbi1zdXItbGVzLXByb2R1aXRzLWRlLWNvbnNvbW1hdGlvbi1tYWl0cmUtbW90LWRlcy1hbWVuZGVtZW50cy_SAQA?hl=fr&gl=MA&ceid=MA%3Afr
Importation des sources de rayonnements ionisants: PortNet lance un nouveau service en ligne,https://news.google.com./articles/CBMiaWh0dHBzOi8vbGVtYXRpbi5tYS9lY29ub21pZS9zb3VyY2VzLWRlLXJheW9ubmVtZW50cy1pb25pc2FudHMtbGltcG9ydGF0aW9uLWRpZ2l0YWxpc2VlLXZpYS1wb3J0bmV0LzE5ODUzMtIBbWh0dHBzOi8vbGVtYXRpbi5tYS9lY29ub21pZS9zb3VyY2VzLWRlLXJheW9ubmVtZW50cy1pb25pc2FudHMtbGltcG9ydGF0aW9uLWRpZ2l0YWxpc2VlLXZpYS1wb3J0bmV0LzE5ODUzMi9hbXA?hl=fr&gl=MA&ceid=MA%3Afr
PLF 2024/Redevances d'importation : une problématique de double imposition résolue,https://news.google.com./articles/CBMieWh0dHBzOi8vbGVzZWNvLm1hL21hcm9jL3BsZi0yMDI0LXJlZGV2YW5jZXMtZGltcG9ydGF0aW9uLXVuZS1wcm9ibGVtYXRpcXVlLWRlLWRvdWJsZS1pbXBvc2l0aW9uLXJlc29sdWUuaHRtbD9QcmVtaXVtPXRydWXSAQA?hl=fr&gl=MA&ceid=MA%3Afr
Smartphones : la hausse des droits de douane serait une aubaine pour la contrebande selon les distributeurs - Médias24,https://news.google.com./articles/CBMiiAFodHRwczovL21lZGlhczI0LmNvbS8yMDIzLzExLzA3L3NtYXJ0cGhvbmVzLXBvdXItbGVzLWRpc3RyaWJ1dGV1cnMtdW5lLWhhdXNzZS1kZXMtZHJvaXRzLWRlLWRvdWFuZS1zZXJhLXVuZS1hdWJhaW5lLXBvdXItbGEtY29udHJlYmFuZGUv0gEA?hl=fr&gl=MA&ceid=MA%3Afr
Importation de blé tendre : le système de restitution à nouveau instauré,https://news.google.com./articles/CBMiY2h0dHBzOi8vbGVzZWNvLm1hL21hcm9jL2ltcG9ydGF0aW9uLWRlLWJsZS10ZW5kcmUtbGUtc3lzdGVtZS1kZS1yZXN0aXR1dGlvbi1hLW5vdXZlYXUtaW5zdGF1cmUuaHRtbNIBAA?hl=fr&gl=MA&ceid=MA%3Afr
Médicaments: le gouvernement acte une nouvelle baisse des droits d'importation,https://news.google.com./articles/CBMihQFodHRwczovL2ZyLmxlMzYwLm1hL2Vjb25vbWllL21lZGljYW1lbnRzLWxlLWdvdXZlcm5lbWVudC1hY3RlLXVuZS1ub3V2ZWxsZS1iYWlzc2UtZGVzLWRyb2l0cy1kaW1wb3J0YXRpb25fUU5LSlg3WVZFUkNGWktGR0RCQlhDNEg2SkEv0gEA?hl=fr&gl=MA&ceid=MA%3Afr
Les importations de pruneaux secs ont généré plus de 50 millions de dirhams,https://news.google.com./articles/CBMia2h0dHBzOi8vbWFyb2MtZGlwbG9tYXRpcXVlLm5ldC9sZXMtaW1wb3J0YXRpb25zLWRlLXBydW5lYXV4LXNlY3Mtb250LWdlbmVyZS1wbHVzLWRlLTUwLW1pbGxpb25zLWRlLWRpcmhhbXMv0gEA?hl=fr&gl=MA&ceid=MA%3Afr
Avocats : les importations marocaines atteignent un record,https://news.google.com./articles/CBMiYGh0dHBzOi8vd3d3LmxlY29ub21pc3RlLmNvbS9mbGFzaC1pbmZvcy9hdm9jYXRzLWxlcy1pbXBvcnRhdGlvbnMtbWFyb2NhaW5lcy1hdHRlaWduZW50LXVuLXJlY29yZNIBAA?hl=fr&gl=MA&ceid=MA%3Afr
Blé tendre : l’ONICL subventionne l'importation de 20 Mqx jusqu'au 31 décembre,https://news.google.com./articles/CBMiZmh0dHBzOi8vbGVkZXNrLm1hL2VuY29udGludS9ibGUtdGVuZHJlLWxvbmljbC1zdWJ2ZW50aW9ubmUtbGltcG9ydGF0aW9uLWRlLTIwLW1xeC1qdXNxdWF1LTMxLWRlY2VtYnJlL9IBAA?hl=fr&gl=MA&ceid=MA%3Afr
PLF 2024/Droits d'importation : les commerçants entre satisfaction et inquiétude,https://news.google.com./articles/CBMid2h0dHBzOi8vbGVzZWNvLm1hL21hcm9jL3BsZi0yMDI0LWRyb2l0cy1kaW1wb3J0YXRpb24tbGVzLWNvbW1lcmNhbnRzLWVudHJlLXNhdGlzZmFjdGlvbi1ldC1pbnF1aWV0dWRlLmh0bWw_UHJlbWl1bT10cnVl0gEA?hl=fr&gl=MA&ceid=MA%3Afr
Digitalisation des procédures d'importation de médicaments au Maroc: bien... mais peut mieux faire,https://news.google.com./articles/CBMilgFodHRwczovL2ZyLmxlMzYwLm1hL2Vjb25vbWllL2RpZ2l0YWxpc2F0aW9uLWRlcy1wcm9jZWR1cmVzLWRpbXBvcnRhdGlvbi1kZS1tZWRpY2FtZW50cy1hdS1tYXJvYy1iaWVuLW1haXMtcGV1dC1taWV1eC1mYWlyZV81VUMyNFRCTk5WQko3S01YMjJWMjIzSEVXSS_SAQA?hl=fr&gl=MA&ceid=MA%3Afr
Secteur laitier : Hausse de la subvention à l'importation de vaches laitières,https://news.google.com./articles/CBMiamh0dHBzOi8vbWFyb2MtZGlwbG9tYXRpcXVlLm5ldC9zZWN0ZXVyLWxhaXRpZXItaGF1c3NlLWRlLWxhLXN1YnZlbnRpb24tYS1saW1wb3J0YXRpb24tZGUtdmFjaGVzLWxhaXRpZXJlcy_SAQA?hl=fr&gl=MA&ceid=MA%3Afr
Blé tendre : l'État verse une prime à l'importation pour 25 millions de quintaux entre juillet et septembre - Médias24,https://news.google.com./articles/CBMiemh0dHBzOi8vbWVkaWFzMjQuY29tLzIwMjMvMDYvMjcvYmxlLXRlbmRyZS1sZXRhdC12ZXJzZS1wcmltZS1saW1wb3J0YXRpb24tZGUtMjUtbWlsbGlvbnMtZGUtcXgtZW50cmUtanVpbGxldC1ldC1zZXB0ZW1icmUv0gEA?hl=fr&gl=MA&ceid=MA%3Afr
"Céréales: le Maroc instaure une prime forfaitaire pour encourager l'importation de 2,5 millions de tonnes de blé",https://news.google.com./articles/CBMimAFodHRwczovL2ZyLmxlMzYwLm1hL2Vjb25vbWllL2NlcmVhbGVzLWxlLW1hcm9jLWluc3RhdXJlLXVuZS1wcmltZS1mb3JmYWl0YWlyZS1wb3VyLWVuY291cmFnZXItbGltcG9ydGF0aW9uLWRlLTI1LW1pbGxpb25zLWRlX1JIV1dKTVVXN05EVkREQVNQQTY0RlVBTlBBL9IBAA?hl=fr&gl=MA&ceid=MA%3Afr
Réduction des droits d'importation des produits pharmaceutiques : le projet de décret adopté,https://news.google.com./articles/CBMie2h0dHBzOi8vd3d3LmxlY29ub21pc3RlLmNvbS9mbGFzaC1pbmZvcy9yZWR1Y3Rpb24tZGVzLWRyb2l0cy1kLWltcG9ydGF0aW9uLWRlcy1wcm9kdWl0cy1waGFybWFjZXV0aXF1ZXMtbGUtcHJvamV0LWRlLWRlY3JldNIBAA?hl=fr&gl=MA&ceid=MA%3Afr
"Quantités, pays fournisseurs, ports de débarquement, primes... tout sur les importations marocaines de blé en 2023",https://news.google.com./articles/CBMinQFodHRwczovL2ZyLmxlMzYwLm1hL2Vjb25vbWllL3F1YW50aXRlcy1wYXlzLWZvdXJuaXNzZXVycy1wb3J0cy1kZS1kZWJhcnF1ZW1lbnQtcHJpbWVzLXRvdXQtc3VyLWxlcy1pbXBvcnRhdGlvbnMtbWFyb2NhaW5lcy1kZS1ibGVfTjJGSENKUUZRVkJUWkFTR1VCWVdBM1dYUU0v0gEA?hl=fr&gl=MA&ceid=MA%3Afr
Fin des subventions pour l'importation de bovins et moutons | L'observateur,https://news.google.com./articles/CBMibGh0dHBzOi8vbG9ic2VydmF0ZXVyLmluZm8vYXJ0aWNsZS8xMDkxODEvZWNvbm9taWUvZmluLWRlcy1zdWJ2ZW50aW9ucy1wb3VyLWxpbXBvcnRhdGlvbi1kZS1ib3ZpbnMtZXQtbW91dG9uc9IBK2h0dHBzOi8vbG9ic2VydmF0ZXVyLmluZm8vYW1wQXJ0aWNsZS8xMDkxODE?hl=fr&gl=MA&ceid=MA%3Afr
Secteur du froid : voici le quotas pour les importations de gaz réfrigérants,https://news.google.com./articles/CBMicmh0dHBzOi8vd3d3LmxlY29ub21pc3RlLmNvbS9mbGFzaC1pbmZvcy9zZWN0ZXVyLWR1LWZyb2lkLXZvaWNpLWxlLXF1b3Rhcy1wb3VyLWxlcy1pbXBvcnRhdGlvbnMtZGUtZ2F6LXJlZnJpZ2VyYW50c9IBAA?hl=fr&gl=MA&ceid=MA%3Afr
Administration des douanes: retour sur les mesures introduites en 2024,https://news.google.com./articles/CBMiaWh0dHBzOi8vd3d3LmxvcGluaW9uLm1hL0FkbWluaXN0cmF0aW9uLWRlcy1kb3VhbmVzLXJldG91ci1zdXItbGVzLW1lc3VyZXMtaW50cm9kdWl0ZXMtZW4tMjAyNF9hNDg2MDYuaHRtbNIBAA?hl=fr&gl=MA&ceid=MA%3Afr
« Ker'Oman ce n'est pas importer du poisson par avion à Lorient ! »,https://news.google.com./articles/CBMihgFodHRwczovL3d3dy5vdWVzdC1mcmFuY2UuZnIvbWVyL3BlY2hlL2tlcm9tYW4tY2UtbmVzdC1wYXMtaW1wb3J0ZXItZHUtcG9pc3Nvbi1wYXItYXZpb24tYS1sb3JpZW50LTYxOGVjMDY0LWFlZmItMTFlZS1hYTYxLTMwNzMzN2IwNmU5OdIBAA?hl=fr&gl=MA&ceid=MA%3Afr
"À Lorient, les Radicaux de gauche sont favorables à l'importation de poisson d'Oman",https://news.google.com./articles/CBMijwFodHRwczovL3d3dy5sZXRlbGVncmFtbWUuZnIvbW9yYmloYW4vbG9yaWVudC01NjEwMC9hLWxvcmllbnQtbGVzLXJhZGljYXV4LWRlLWdhdWNoZS1zb250LWZhdm9yYWJsZXMtYS1saW1wb3J0YXRpb24tZGUtcG9pc3Nvbi1kb21hbi02NTAxNTQ4LnBocNIBAA?hl=fr&gl=MA&ceid=MA%3Afr
USA: la FDA autorise la Floride à importer des médicaments sur ordonnance du Canada,https://news.google.com./articles/CBMiaGh0dHBzOi8vbWFyb2MtZGlwbG9tYXRpcXVlLm5ldC91c2EtbGEtZmRhLWF1dG9yaXNlLWxhLWZsb3JpZGUtYS1pbXBvcnRlci1kZXMtbWVkaWNhbWVudHMtc3VyLW9yZG9ubmFuY2Uv0gEA?hl=fr&gl=MA&ceid=MA%3Afr
"Blé tendre : le Maroc va importer 2,5 millions de tonnes",https://news.google.com./articles/CBMiVGh0dHBzOi8vYXVqb3VyZGh1aS5tYS9lY29ub21pZS9ibGUtdGVuZHJlLWxlLW1hcm9jLXZhLWltcG9ydGVyLTI1LW1pbGxpb25zLWRlLXRvbm5lc9IBAA?hl=fr&gl=MA&ceid=MA%3Afr
Importation de blé : l'ONICL fixe la prime forfaitaire pour avril 2024,https://news.google.com./articles/CBMiR2h0dHBzOi8vZWNvYWN0dS5tYS9pbXBvcnRhdGlvbi1kZS1ibGUtbG9uaWNsLWZpeGUtbGEtcHJpbWUtZm9yZmFpdGFpcmUv0gEA?hl=fr&gl=MA&ceid=MA%3Afr
Arrêt du soutien à l'importation d'ovins en attendant l'adoption de nouvelles mesures,https://news.google.com./articles/CBMiG2h0dHBzOi8vbGFyZWxldmUubWEvMTEwMzkxL9IBAA?hl=fr&gl=MA&ceid=MA%3Afr
Importation de services. Pas plus de 100.000 DH pour les prestations rendues par les non-résidents,https://news.google.com./articles/CBMijwFodHRwczovL3d3dy5jaGFsbGVuZ2UubWEvaW1wb3J0YXRpb24tZGUtc2VydmljZXMtMTAwLTAwMC1kaC1tYXgtcG91ci1sZXMtcHJlc3RhdGlvbnMtcmVuZHVlcy1wYXItZGVzLXBlcnNvbm5lcy1waHlzaXF1ZXMtbm9uLXJlc2lkZW50ZXMtMjc0NTEwL9IBAA?hl=fr&gl=MA&ceid=MA%3Afr
Une société sud-coréenne signe un contrat d'importation du graphite du Vietnam,https://news.google.com./articles/CBMicGh0dHBzOi8vbGVjb3Vycmllci52bi91bmUtc29jaWV0ZS1zdWQtY29yZWVubmUtc2lnbmUtdW4tY29udHJhdC1kaW1wb3J0YXRpb24tZHUtZ3JhcGhpdGUtZHUtdmlldG5hbS8xMjI0MzExLmh0bWzSAQA?hl=fr&gl=MA&ceid=MA%3Afr
Blé tendre: le Maroc opte pour l'importation,https://news.google.com./articles/CBMiXmh0dHBzOi8vZnIubGUzNjAubWEvZWNvbm9taWUvYmxlLXRlbmRyZS1sZS1tYXJvYy1vcHRlLWxpbXBvcnRhdGlvbl9HNVZKMlNHTVhCRjRYQjM1TlM3RzRZTVhJVS_SAQA?hl=fr&gl=MA&ceid=MA%3Afr
Restrictions à l'importation : 52 nomenclatures soumises à licence,https://news.google.com./articles/CBMiXGh0dHBzOi8vbGVzZWNvLm1hL21hcm9jL3Jlc3RyaWN0aW9ucy1hLWxpbXBvcnRhdGlvbi01Mi1ub21lbmNsYXR1cmVzLXNvdW1pc2VzLWEtbGljZW5jZS5odG1s0gEA?hl=fr&gl=MA&ceid=MA%3Afr
Impôts PLF 2024: réduction de la quotité du droit d'importation à 30% sur les produits soumis au taux de 40%,https://news.google.com./articles/CBMifmh0dHBzOi8vbGVkZXNrLm1hL2VuY29udGludS9wbGYtMjAyNC1yZWR1Y3Rpb24tZGUtbGEtcXVvdGl0ZS1kdS1kcm9pdC1kaW1wb3J0YXRpb24tYS0zMC1zdXItbGVzLXByb2R1aXRzLXNvdW1pcy1hdS10YXV4LWRlLTQwL9IBAA?hl=fr&gl=MA&ceid=MA%3Afr
PLF 2024 : Les droits d'importation au centre des amendements,https://news.google.com./articles/CBMiXWh0dHBzOi8vd3d3LmxhdmllZWNvLmNvbS9hZmZhaXJlcy9wbGYtMjAyNC1sZXMtZHJvaXRzLWRpbXBvcnRhdGlvbi1hdS1jZW50cmUtZGVzLWFtZW5kZW1lbnRzL9IBAA?hl=fr&gl=MA&ceid=MA%3Afr
Câbles de fibre optique : les coulisses de l'augmentation des droits d'importation pour soutenir l'industrie nationale ...,https://news.google.com./articles/CBMihQFodHRwczovL21lZGlhczI0LmNvbS8yMDIzLzExLzIxL2NhYmxlcy1kZS1maWJyZS1vcHRpcXVlLWxlcy1kcm9pdHMtZGltcG9ydGF0aW9uLWF1Z21lbnRlcm9udC1hLTEwLXBvdXItc291dGVuaXItbGluZHVzdHJpZS1uYXRpb25hbGUv0gEA?hl=fr&gl=MA&ceid=MA%3Afr
Agriculture : Le blé tendre importé bénéficie d'une subvention forfaitaire,https://news.google.com./articles/CBMiZ2h0dHBzOi8vbWFyb2MtZGlwbG9tYXRpcXVlLm5ldC9hZ3JpY3VsdHVyZS1sZS1ibGUtdGVuZHJlLWltcG9ydGUtYmVuZWZpY2llLWR1bmUtc3VidmVudGlvbi1mb3JmYWl0YWlyZS_SAQA?hl=fr&gl=MA&ceid=MA%3Afr
"Meubles, matelas et tapis usagés: nouvelles restrictions à l'import",https://news.google.com./articles/CBMieWh0dHBzOi8vZnIubGUzNjAubWEvZWNvbm9taWUvbWV1Ymxlcy1tYXRlbGFzLWV0LXRhcGlzLXVzYWdlcy1ub3V2ZWxsZXMtcmVzdHJpY3Rpb25zLWEtbGltcG9ydF8zUjc1UVpPRk41Q0ZaQldHTE1HQ0lJQ080VS_SAQA?hl=fr&gl=MA&ceid=MA%3Afr
Le Maroc interdit l'importation de bovins en provenance d'Europe,https://news.google.com./articles/CBMidmh0dHBzOi8vZnIubGUzNjAubWEvc29jaWV0ZS9sZS1tYXJvYy1pbnRlcmRpdC1saW1wb3J0YXRpb24tZGUtYm92aW5zLWVuLXByb3ZlbmFuY2UtZGV1cm9wZV9CUlNSN1NKWUNGRlBER1JMQlZSU1dSS01aQS_SAQA?hl=fr&gl=MA&ceid=MA%3Afr
"Désintox. Non, il n'y a pas eu d'interdiction d'importation de bovins en provenance d'Europe",https://news.google.com./articles/CBMijwFodHRwczovL2ZyLmxlMzYwLm1hL2Vjb25vbWllL2Rlc2ludG94LW5vbi1pbC1ueS1hLXBhcy1ldS1kaW50ZXJkaWN0aW9uLWRpbXBvcnRhdGlvbi1kZS1ib3ZpbnMtZW4tcHJvdmVuYW5jZS1kZXVyb3BlXzdKN0tCUTZZV0ZDVEhMV1BFNzZIRFNQTjdFL9IBAA?hl=fr&gl=MA&ceid=MA%3Afr
Le nouveau portail des notifications concernant les licences d'importation est maintenant disponible,https://news.google.com./articles/CBMiPWh0dHBzOi8vd3d3Lnd0by5vcmcvZnJlbmNoL25ld3NfZi9uZXdzMjNfZi9pbXBsXzMxb2N0MjNfZi5odG3SAQA?hl=fr&gl=MA&ceid=MA%3Afr
PLF-2024 - droit d'importation : ce qui est prévu pour les produits soumis au taux de 40%,https://news.google.com./articles/CBMifGh0dHBzOi8vd3d3LmxlY29ub21pc3RlLmNvbS9mbGFzaC1pbmZvcy9wbGYtMjAyNC1kcm9pdC1kLWltcG9ydGF0aW9uLWNlLXF1aS1lc3QtcHJldnUtcG91ci1sZXMtcHJvZHVpdHMtc291bWlzLWF1LXRhdXgtZGUtNDDSAQA?hl=fr&gl=MA&ceid=MA%3Afr
Importation des produits alimentaires : Enregistrement des fournisseurs étrangers dès le 1er janvier 2024,https://news.google.com./articles/CBMihQFodHRwczovL2F1am91cmRodWkubWEvc29jaWV0ZS9pbXBvcnRhdGlvbi1kZXMtcHJvZHVpdHMtYWxpbWVudGFpcmVzLWVucmVnaXN0cmVtZW50LWRlcy1mb3Vybmlzc2V1cnMtZXRyYW5nZXJzLWRlcy1sZS0xZXItamFudmllci0yMDI00gEA?hl=fr&gl=MA&ceid=MA%3Afr
Avocat: Vers un niveau d'importation record,https://news.google.com./articles/CBMiTmh0dHBzOi8vd3d3LmxvcGluaW9uLm1hL0F2b2NhdC1WZXJzLXVuLW5pdmVhdS1kLWltcG9ydGF0aW9uLXJlY29yZF9hNDcyNDcuaHRtbNIBAA?hl=fr&gl=MA&ceid=MA%3Afr
Agriculture : l'importation des mangues explose,https://news.google.com./articles/CBMiSWh0dHBzOi8vbGVzZWNvLm1hL21hcm9jL2FncmljdWx0dXJlLWxpbXBvcnRhdGlvbi1kZXMtbWFuZ3Vlcy1leHBsb3NlLmh0bWzSAQA?hl=fr&gl=MA&ceid=MA%3Afr
"Importation de blé : la Russie, nouveau fournisseur du Maroc",https://news.google.com./articles/CBMiWWh0dHBzOi8vbWFyb2MtZGlwbG9tYXRpcXVlLm5ldC9pbXBvcnRhdGlvbi1kZS1ibGUtbGEtcnVzc2llLW5vdXZlYXUtZm91cm5pc3NldXItZHUtbWFyb2Mv0gEA?hl=fr&gl=MA&ceid=MA%3Afr
Le Maroc ordonne l'arrêt de l'importation et de la distribution de l'éponge de gélatine hémostatique Equispon,https://news.google.com./articles/CBMimQFodHRwczovL2ZyLmxlMzYwLm1hL3NvY2lldGUvbGUtbWFyb2Mtb3Jkb25uZS1sYXJyZXQtZGUtbGltcG9ydGF0aW9uLWV0LWRlLWxhLWRpc3RyaWJ1dGlvbi1kZS1sZXBvbmdlLWRlLWdlbGF0aW5lLWhlbW9zdGF0aXF1ZV9DSVQ3SEs1RklaQ05MQldUNVpYTUs0WkZHUS_SAQA?hl=fr&gl=MA&ceid=MA%3Afr
Douanes et impôts indirects : les principales propositions du PLF 2024 - Médias24,https://news.google.com./articles/CBMiZWh0dHBzOi8vbWVkaWFzMjQuY29tLzIwMjMvMTAvMjAvZG91YW5lcy1ldC1pbXBvdHMtaW5kaXJlY3RzLWxlcy1wcmluY2lwYWxlcy1wcm9wb3NpdGlvbnMtZHUtcGxmLTIwMjQv0gEA?hl=fr&gl=MA&ceid=MA%3Afr
Véhicules électriques : l'État étend les exonérations fiscales à l'importation des batteries,https://news.google.com./articles/CBMijAFodHRwczovL3d3dy50b2dvZmlyc3QuY29tL2ZyL3RyYW5zcG9ydC8wOTAxLTEzMjAxLXZlaGljdWxlcy1lbGVjdHJpcXVlcy1sLWV0YXQtZXRlbmQtbGVzLWV4b25lcmF0aW9ucy1maXNjYWxlcy1hLWwtaW1wb3J0YXRpb24tZGVzLWJhdHRlcmllc9IBAA?hl=fr&gl=MA&ceid=MA%3Afr
"Blé tendre: importation de 2,5 MT supplémentaires, le système de restitution reconduit jusqu'à avril",https://news.google.com./articles/CBMigwFodHRwOi8vbW9iaWxlLmxlZGVzay5tYS9lbmNvbnRpbnUvYmxlLXRlbmRyZS1pbXBvcnRhdGlvbi1kZS0yNS1tdC1zdXBwbGVtZW50YWlyZXMtbGUtc3lzdGVtZS1kZS1yZXN0aXR1dGlvbi1yZWNvbmR1aXQtanVzcXVhLWF2cmlsL9IBAA?hl=fr&gl=MA&ceid=MA%3Afr
Droits d'importation sur les smartphones : un cadeau au marché noir,https://news.google.com./articles/CBMiZWh0dHBzOi8vd3d3LmxvcGluaW9uLm1hL0Ryb2l0cy1kLWltcG9ydGF0aW9uLXN1ci1sZXMtc21hcnRwaG9uZXMtdW4tY2FkZWF1LWF1LW1hcmNoZS1ub2lyX2E0NzI0MS5odG1s0gEA?hl=fr&gl=MA&ceid=MA%3Afr
Commerce Royaume-Uni: vers une baisse des droits d'importation sur les fruits et légumes marocains,https://news.google.com./articles/CBMidGh0dHBzOi8vbGVkZXNrLm1hL2VuY29udGludS9yb3lhdW1lLXVuaS12ZXJzLXVuZS1iYWlzc2UtZGVzLWRyb2l0cy1kaW1wb3J0YXRpb24tc3VyLWxlcy1mcnVpdHMtZXQtbGVndW1lcy1tYXJvY2FpbnMv0gEA?hl=fr&gl=MA&ceid=MA%3Afr
PLF 2024 : la révision des droits d’importation sur les produits de grande consommation en discussions chez les conseillers,https://news.google.com./articles/CBMiXGh0dHBzOi8vbGVtYXRpbi5tYS9uYXRpb24vcGxmLTIwMjQtbGEtcmV2aXNpb24tZGVzLWRyb2l0cy1kaW1wb3J0YXRpb24tZW4tZGlzY3Vzc2lvbnMvMjAyMDUw0gFgaHR0cHM6Ly9sZW1hdGluLm1hL25hdGlvbi9wbGYtMjAyNC1sYS1yZXZpc2lvbi1kZXMtZHJvaXRzLWRpbXBvcnRhdGlvbi1lbi1kaXNjdXNzaW9ucy8yMDIwNTAvYW1w?hl=fr&gl=MA&ceid=MA%3Afr
"Blé: le Maroc reconduit son système de restitution pour l'importation de 2,5 millions de tonnes entre janvier et avril 2024",https://news.google.com./articles/CBMimwFodHRwczovL2ZyLmxlMzYwLm1hL2Vjb25vbWllL2JsZS1sZS1tYXJvYy1yZWNvbmR1aXQtc29uLXN5c3RlbWUtZGUtcmVzdGl0dXRpb24tcG91ci1saW1wb3J0YXRpb24tZGUtMjUtbWlsbGlvbnMtZGUtdG9ubmVzLWVudHJlX0M0TDdNR1pHNU5EWjdHS1BMSkI1UktSSzVBL9IBAA?hl=fr&gl=MA&ceid=MA%3Afr
Albert : le culturiste condamné pour importation et usage de stéroïdes,https://news.google.com./articles/CBMif2h0dHBzOi8vd3d3LmNvdXJyaWVyLXBpY2FyZC5mci9pZDQ4MjIzOS9hcnRpY2xlLzIwMjQtMDEtMDkvYWxiZXJ0LWxlLWN1bHR1cmlzdGUtY29uZGFtbmUtcG91ci1pbXBvcnRhdGlvbi1ldC11c2FnZS1kZS1zdGVyb2lkZXPSAQA?hl=fr&gl=MA&ceid=MA%3Afr
Le Maroc prévoit d'importer 25 millions de quintaux de blé avec une prime forfaitaire,https://news.google.com./articles/CBMiLGh0dHBzOi8vd3d3LnBhbm9yYXBvc3QuY29tL3Bvc3QucGhwP2lkPTQzODUy0gEA?hl=fr&gl=MA&ceid=MA%3Afr
PLF-2024 : verdissement du tarif des droits d'importation,https://news.google.com./articles/CBMibmh0dHBzOi8vbW9iaWxlLnRlbHF1ZWwubWEvaW5zdGFudC10LzIwMjMvMDkvMDcvcGxmLTIwMjQtdmVyZGlzc2VtZW50LWR1LXRhcmlmLWRlcy1kcm9pdHMtZGltcG9ydGF0aW9uXzE4Mjk1MzEv0gEA?hl=fr&gl=MA&ceid=MA%3Afr
"Importation de Blé Tendre : 2,5 MT supplémentaires et reconduction du Système de Restitution",https://news.google.com./articles/CBMifWh0dHBzOi8vd3d3LmxvcGluaW9uLm1hL0ltcG9ydGF0aW9uLWRlLUJsZS1UZW5kcmUtMjUtTVQtc3VwcGxlbWVudGFpcmVzLWV0LXJlY29uZHVjdGlvbi1kdS1TeXN0ZW1lLWRlLVJlc3RpdHV0aW9uX2E0NzA4OC5odG1s0gEA?hl=fr&gl=MA&ceid=MA%3Afr
Épidémie de punaises de lit : Le Maroc durcit ses contrôles sur les importations de tapis et matelas européens,https://news.google.com./articles/CBMiWWh0dHBzOi8vbWFyb2MtZGlwbG9tYXRpcXVlLm5ldC9lcGlkZW1pZS1kZS1wdW5haXNlcy1kZS1saXQtbGUtbWFyb2MtZHVyY2l0LXNlcy1jb250cm9sZXMv0gEA?hl=fr&gl=MA&ceid=MA%3Afr
L'opposition rejette la hausse de la taxe à l'importation sur les iPhones,https://news.google.com./articles/CBMiZ2h0dHBzOi8vbWFyb2MtZGlwbG9tYXRpcXVlLm5ldC9sb3Bwb3NpdGlvbi1yZWpldHRlLWxhLWhhdXNzZS1kZS1sYS10YXhlLWEtbGltcG9ydGF0aW9uLXN1ci1sZXMtaXBob25lcy_SAQA?hl=fr&gl=MA&ceid=MA%3Afr
PLF 2024/ Miettes de thon : une baisse du droit d'importation prévue,https://news.google.com./articles/CBMiaWh0dHBzOi8vd3d3LmxlY29ub21pc3RlLmNvbS9mbGFzaC1pbmZvcy9wbGYtMjAyNC1taWV0dGVzLWRlLXRob24tdW5lLWJhaXNzZS1kdS1kcm9pdC1kLWltcG9ydGF0aW9uLXByZXZ1ZdIBAA?hl=fr&gl=MA&ceid=MA%3Afr
Le Maroc maintient sa confiance au blé français,https://news.google.com./articles/CBMiSGh0dHBzOi8vd3d3LmJsYWRpLm5ldC9tYXJvYy1tYWludGllbnQtY29uZmlhbmNlLWJsZS1mcmFuY2FpcywxMDU5ODcuaHRtbNIBAA?hl=fr&gl=MA&ceid=MA%3Afr
PLF 2024. Hausse des droits de douanes sur les vapo et les petits appareils électriques,https://news.google.com./articles/CBMid2h0dHBzOi8vd3d3LmxhdmllZWNvLmNvbS9hcmdlbnQvcGxmLTIwMjQtaGF1c3NlLWRlcy1kcm9pdHMtZGUtZG91YW5lcy1zdXItbGVzLXZhcG8tZXQtbGVzLXBldGl0cy1hcHBhcmVpbHMtZWxlY3RyaXF1ZXMv0gEA?hl=fr&gl=MA&ceid=MA%3Afr
Algérie : l'importation de bus de moins de cinq ans autorisée !,https://news.google.com./articles/CBMiUmh0dHBzOi8vd3d3LmJldXJmbS5uZXQvYWxnZXJpZS1sLWltcG9ydGF0aW9uLWRlLWJ1cy1kZS1tb2lucy1kZS1jaW5xLWFucy1hdXRvcmlzZWXSAQA?hl=fr&gl=MA&ceid=MA%3Afr
PortNet intègre les autorisations d'importation des sources de rayonnements ionisants - Médias24,https://news.google.com./articles/CBMidWh0dHBzOi8vbWVkaWFzMjQuY29tLzIwMjMvMTAvMzEvcG9ydG5ldC1pbnRlZ3JlLWxlcy1hdXRvcmlzYXRpb25zLWRpbXBvcnRhdGlvbi1kZXMtc291cmNlcy1kZS1yYXlvbm5lbWVudHMtaW9uaXNhbnRzL9IBAA?hl=fr&gl=MA&ceid=MA%3Afr
Vingt membres présumés d'un réseau d'importation de cigarettes contrefaites jugés à Bordeaux,https://news.google.com./articles/CBMimQFodHRwczovL3d3dy5mcmFuY2VibGV1LmZyL2luZm9zL2ZhaXRzLWRpdmVycy1qdXN0aWNlL3Zpbmd0LW1lbWJyZXMtcHJlc3VtZXMtZC11bi1yZXNlYXUtZC1pbXBvcnRhdGlvbi1kZS1jaWdhcmV0dGVzLWNvbnRyZWZhaXRlcy1qdWdlcy1hLWJvcmRlYXV4LTk4NDI5NznSAQA?hl=fr&gl=MA&ceid=MA%3Afr
PLF-2024 : vers une augmentation du droit d'importation des cigarettes électroniques à 40%,https://news.google.com./articles/CBMijgFodHRwczovL21vYmlsZS50ZWxxdWVsLm1hL2luc3RhbnQtdC8yMDIzLzEwLzIzL3BsZi0yMDI0LXZlcnMtdW5lLWF1Z21lbnRhdGlvbi1kdS1kcm9pdC1kaW1wb3J0YXRpb24tZGVzLWNpZ2FyZXR0ZXMtZWxlY3Ryb25pcXVlcy1hLTQwXzE4MzcwMTQv0gEA?hl=fr&gl=MA&ceid=MA%3Afr
Importation de vaches laitières: une subvention de 6.000 dirhams par tête désormais accordée,https://news.google.com./articles/CBMikwFodHRwczovL2ZyLmxlMzYwLm1hL2Vjb25vbWllL2ltcG9ydGF0aW9uLWRlLXZhY2hlcy1sYWl0aWVyZXMtdW5lLXN1YnZlbnRpb24tZGUtNjAwMC1kaXJoYW1zLXBhci10ZXRlLWRlc29ybWFpcy1hY2NvcmRlZV9USDNWWTVVUVZWSFYzS0xKS0Y0MjdPVkFGSS_SAQA?hl=fr&gl=MA&ceid=MA%3Afr
Les groupes majoritaires proposent de réduire la taxe sur l'importation des smartphones à bas prix,https://news.google.com./articles/CBMimAFodHRwczovL21vYmlsZS50ZWxxdWVsLm1hL2luc3RhbnQtdC8yMDIzLzExLzEwL2xlcy1ncm91cGVzLW1ham9yaXRhaXJlcy1wcm9wb3NlbnQtZGUtcmVkdWlyZS1sYS10YXhlLXN1ci1saW1wb3J0YXRpb24tZGUtc21hcnRwaG9uZXMtYS1iYXMtcHJpeF8xODQwNTQzL9IBAA?hl=fr&gl=MA&ceid=MA%3Afr
L'importation de mangues vers le Maroc continue d'augmenter ! – AgriMaroc.ma,https://news.google.com./articles/CBMiLmh0dHBzOi8vd3d3LmFncmltYXJvYy5tYS9pbXBvcnQtbWFyb2MtbWFuZ3Vlcy_SAQA?hl=fr&gl=MA&ceid=MA%3Afr
Finances PLF-2024: les principaux amendements pour réduire progressivement les droits d'importation,https://news.google.com./articles/CBMidWh0dHBzOi8vbGVkZXNrLm1hL2VuY29udGludS9wbGYtMjAyNC1sZXMtcHJpbmNpcGF1eC1hbWVuZGVtZW50cy1wb3VyLXJlZHVpcmUtcHJvZ3Jlc3NpdmVtZW50LWxlcy1kcm9pdHMtZGltcG9ydGF0aW9uL9IBAA?hl=fr&gl=MA&ceid=MA%3Afr
Augmentation des droits d'importation: Un coup de boost à la production locale,https://news.google.com./articles/CBMiUGh0dHBzOi8vbGFxdW90aWRpZW5uZS5tYS9hcnRpY2xlL2Vjb25vbWllL2F1Z21lbnRhdGlvbi1kcm9pdHMtaW1wb3J0YXRpb25zLW1hcm9j0gEA?hl=fr&gl=MA&ceid=MA%3Afr
Le Maroc réduit ses importations de céréales malgré la sécheresse,https://news.google.com./articles/CBMiYWh0dHBzOi8vbWFyb2MtZGlwbG9tYXRpcXVlLm5ldC9sZS1tYXJvYy1yZWR1aXQtc2VzLWltcG9ydGF0aW9ucy1kZS1jZXJlYWxlcy1tYWxncmUtbGEtc2VjaGVyZXNzZS_SAQA?hl=fr&gl=MA&ceid=MA%3Afr
Importation d'aliments de bétail : la TVA passe à 10%,https://news.google.com./articles/CBMiTmh0dHBzOi8vbGVzZWNvLm1hL21hcm9jL2ltcG9ydGF0aW9uLWRhbGltZW50cy1kZS1iZXRhaWwtbGEtdHZhLXBhc3NlLWEtMTAuaHRtbNIBAA?hl=fr&gl=MA&ceid=MA%3Afr
Véhicules électriques : Le Togo étend les exonérations fiscales à l'importation des batteries,https://news.google.com./articles/CBMib2h0dHBzOi8vYWZyaXF1ZWl0bmV3cy5jb20vZmluYW5jZS92ZWhpY3VsZXMtZWxlY3RyaXF1ZXMtdG9nby1ldGVuZC1leG9uZXJhdGlvbnMtZmlzY2FsZXMtaW1wb3J0YXRpb24tYmF0dGVyaWVzL9IBAA?hl=fr&gl=MA&ceid=MA%3Afr
Importation de panneaux en bois revêtus : le quota fixé,https://news.google.com./articles/CBMiXWh0dHBzOi8vd3d3LmxlY29ub21pc3RlLmNvbS9mbGFzaC1pbmZvcy9pbXBvcnRhdGlvbi1kZS1wYW5uZWF1eC1lbi1ib2lzLXJldmV0dXMtbGUtcXVvdGEtZml4ZdIBAA?hl=fr&gl=MA&ceid=MA%3Afr
"Blé: en novembre, le Maroc a presque triplé ses importations en provenance de la Russie",https://news.google.com./articles/CBMijgFodHRwczovL2ZyLmxlMzYwLm1hL2Vjb25vbWllL2JsZS1lbi1ub3ZlbWJyZS1sZS1tYXJvYy1hLXByZXNxdWUtdHJpcGxlLXNlcy1pbXBvcnRhdGlvbnMtZW4tcHJvdmVuYW5jZS1kZS1sYS1ydXNzaWVfUEVJVUE0TjdGWkFOWFBHNjdTNlA0Tlk2UzQv0gEA?hl=fr&gl=MA&ceid=MA%3Afr
Droits d'importation sur les tôles laminées : une augmentation préventive avant tout,https://news.google.com./articles/CBMie2h0dHBzOi8vbGVzZWNvLm1hL21hcm9jL2Ryb2l0cy1kaW1wb3J0YXRpb24tc3VyLWxlcy10b2xlcy1sYW1pbmVlcy11bmUtYXVnbWVudGF0aW9uLXByZXZlbnRpdmUtYXZhbnQtdG91dC5odG1sP1ByZW1pdW09dHJ1ZdIBAA?hl=fr&gl=MA&ceid=MA%3Afr
« Ker'Oman ce n'est pas importer du poisson par avion à Lorient ! »,https://news.google.com./articles/CBMicmh0dHBzOi8vd3d3LmZyYW5jZWxpdmUuZnIvdGVhc2VyL291ZXN0LWZyYW5jZS9rZXJvbWFuLWNlLW5lc3QtcGFzLWltcG9ydGVyLWR1LXBvaXNzb24tcGFyLWF2aW9uLWEtbG9yaWVudC04MzUyNzU4L9IBAA?hl=fr&gl=MA&ceid=MA%3Afr
Sécurité Alimentaire : Le Maroc prévoit d'importer 2 millions de tonnes de blé tendre,https://news.google.com./articles/CBMid2h0dHBzOi8vd3d3LmxvcGluaW9uLm1hL1NlY3VyaXRlLUFsaW1lbnRhaXJlLUxlLU1hcm9jLXByZXZvaXQtZC1pbXBvcnRlci0yLW1pbGxpb25zLWRlLXRvbm5lcy1kZS1ibGUtdGVuZHJlX2E0NDQ3OS5odG1s0gEA?hl=fr&gl=MA&ceid=MA%3Afr
Avocat : Les importations marocaines devraient enregistrer un nouveau record en 2023,https://news.google.com./articles/CBMiaWh0dHBzOi8vbGVtYXRpbi5tYS9lY29ub21pZS9sZXMtaW1wb3J0YXRpb25zLWRhdm9jYXRzLWF0dGVpZ25lbnQtMTM1MDAtdG9ubmVzLWEtZmluLXNlcHRlbWJyZS0yMDIzLzIwMzM2MdIBbWh0dHBzOi8vbGVtYXRpbi5tYS9lY29ub21pZS9sZXMtaW1wb3J0YXRpb25zLWRhdm9jYXRzLWF0dGVpZ25lbnQtMTM1MDAtdG9ubmVzLWEtZmluLXNlcHRlbWJyZS0yMDIzLzIwMzM2MS9hbXA?hl=fr&gl=MA&ceid=MA%3Afr
Céréales: le Maroc instaure une nouvelle prime forfaitaire pour l'importation de 2 millions de tonnes de blé,https://news.google.com./articles/CBMinAFodHRwczovL2ZyLmxlMzYwLm1hL2Vjb25vbWllL2NlcmVhbGVzLWxlLW1hcm9jLWluc3RhdXJlLXVuZS1ub3V2ZWxsZS1wcmltZS1mb3JmYWl0YWlyZS1wb3VyLWxpbXBvcnRhdGlvbi1kZS0yLW1pbGxpb25zLWRlLXRvbm5lc19MUVhJUURZWEpaQ05KR05DRUhTN0Y3M0pNNC_SAQA?hl=fr&gl=MA&ceid=MA%3Afr
