Review,Link
PLF 2024. Hausse des droits de douanes sur les vapo et les petits appareils électriques,https://news.google.com./articles/CBMid2h0dHBzOi8vd3d3LmxhdmllZWNvLmNvbS9hcmdlbnQvcGxmLTIwMjQtaGF1c3NlLWRlcy1kcm9pdHMtZGUtZG91YW5lcy1zdXItbGVzLXZhcG8tZXQtbGVzLXBldGl0cy1hcHBhcmVpbHMtZWxlY3RyaXF1ZXMv0gEA?hl=fr&gl=MA&ceid=MA%3Afr
Algérie : l'importation de bus de moins de cinq ans autorisée !,https://news.google.com./articles/CBMiUmh0dHBzOi8vd3d3LmJldXJmbS5uZXQvYWxnZXJpZS1sLWltcG9ydGF0aW9uLWRlLWJ1cy1kZS1tb2lucy1kZS1jaW5xLWFucy1hdXRvcmlzZWXSAQA?hl=fr&gl=MA&ceid=MA%3Afr
PortNet intègre les autorisations d'importation des sources de rayonnements ionisants - Médias24,https://news.google.com./articles/CBMidWh0dHBzOi8vbWVkaWFzMjQuY29tLzIwMjMvMTAvMzEvcG9ydG5ldC1pbnRlZ3JlLWxlcy1hdXRvcmlzYXRpb25zLWRpbXBvcnRhdGlvbi1kZXMtc291cmNlcy1kZS1yYXlvbm5lbWVudHMtaW9uaXNhbnRzL9IBAA?hl=fr&gl=MA&ceid=MA%3Afr
Vingt membres présumés d'un réseau d'importation de cigarettes contrefaites jugés à Bordeaux,https://news.google.com./articles/CBMimQFodHRwczovL3d3dy5mcmFuY2VibGV1LmZyL2luZm9zL2ZhaXRzLWRpdmVycy1qdXN0aWNlL3Zpbmd0LW1lbWJyZXMtcHJlc3VtZXMtZC11bi1yZXNlYXUtZC1pbXBvcnRhdGlvbi1kZS1jaWdhcmV0dGVzLWNvbnRyZWZhaXRlcy1qdWdlcy1hLWJvcmRlYXV4LTk4NDI5NznSAQA?hl=fr&gl=MA&ceid=MA%3Afr
PLF-2024 : vers une augmentation du droit d'importation des cigarettes électroniques à 40%,https://news.google.com./articles/CBMijgFodHRwczovL21vYmlsZS50ZWxxdWVsLm1hL2luc3RhbnQtdC8yMDIzLzEwLzIzL3BsZi0yMDI0LXZlcnMtdW5lLWF1Z21lbnRhdGlvbi1kdS1kcm9pdC1kaW1wb3J0YXRpb24tZGVzLWNpZ2FyZXR0ZXMtZWxlY3Ryb25pcXVlcy1hLTQwXzE4MzcwMTQv0gEA?hl=fr&gl=MA&ceid=MA%3Afr
Importation de vaches laitières: une subvention de 6.000 dirhams par tête désormais accordée,https://news.google.com./articles/CBMikwFodHRwczovL2ZyLmxlMzYwLm1hL2Vjb25vbWllL2ltcG9ydGF0aW9uLWRlLXZhY2hlcy1sYWl0aWVyZXMtdW5lLXN1YnZlbnRpb24tZGUtNjAwMC1kaXJoYW1zLXBhci10ZXRlLWRlc29ybWFpcy1hY2NvcmRlZV9USDNWWTVVUVZWSFYzS0xKS0Y0MjdPVkFGSS_SAQA?hl=fr&gl=MA&ceid=MA%3Afr
Les groupes majoritaires proposent de réduire la taxe sur l'importation des smartphones à bas prix,https://news.google.com./articles/CBMimAFodHRwczovL21vYmlsZS50ZWxxdWVsLm1hL2luc3RhbnQtdC8yMDIzLzExLzEwL2xlcy1ncm91cGVzLW1ham9yaXRhaXJlcy1wcm9wb3NlbnQtZGUtcmVkdWlyZS1sYS10YXhlLXN1ci1saW1wb3J0YXRpb24tZGUtc21hcnRwaG9uZXMtYS1iYXMtcHJpeF8xODQwNTQzL9IBAA?hl=fr&gl=MA&ceid=MA%3Afr
L'importation de mangues vers le Maroc continue d'augmenter ! – AgriMaroc.ma,https://news.google.com./articles/CBMiLmh0dHBzOi8vd3d3LmFncmltYXJvYy5tYS9pbXBvcnQtbWFyb2MtbWFuZ3Vlcy_SAQA?hl=fr&gl=MA&ceid=MA%3Afr
Finances PLF-2024: les principaux amendements pour réduire progressivement les droits d'importation,https://news.google.com./articles/CBMidWh0dHBzOi8vbGVkZXNrLm1hL2VuY29udGludS9wbGYtMjAyNC1sZXMtcHJpbmNpcGF1eC1hbWVuZGVtZW50cy1wb3VyLXJlZHVpcmUtcHJvZ3Jlc3NpdmVtZW50LWxlcy1kcm9pdHMtZGltcG9ydGF0aW9uL9IBAA?hl=fr&gl=MA&ceid=MA%3Afr
Augmentation des droits d'importation: Un coup de boost à la production locale,https://news.google.com./articles/CBMiUGh0dHBzOi8vbGFxdW90aWRpZW5uZS5tYS9hcnRpY2xlL2Vjb25vbWllL2F1Z21lbnRhdGlvbi1kcm9pdHMtaW1wb3J0YXRpb25zLW1hcm9j0gEA?hl=fr&gl=MA&ceid=MA%3Afr
Le Maroc réduit ses importations de céréales malgré la sécheresse,https://news.google.com./articles/CBMiYWh0dHBzOi8vbWFyb2MtZGlwbG9tYXRpcXVlLm5ldC9sZS1tYXJvYy1yZWR1aXQtc2VzLWltcG9ydGF0aW9ucy1kZS1jZXJlYWxlcy1tYWxncmUtbGEtc2VjaGVyZXNzZS_SAQA?hl=fr&gl=MA&ceid=MA%3Afr
Importation d'aliments de bétail : la TVA passe à 10%,https://news.google.com./articles/CBMiTmh0dHBzOi8vbGVzZWNvLm1hL21hcm9jL2ltcG9ydGF0aW9uLWRhbGltZW50cy1kZS1iZXRhaWwtbGEtdHZhLXBhc3NlLWEtMTAuaHRtbNIBAA?hl=fr&gl=MA&ceid=MA%3Afr
Véhicules électriques : Le Togo étend les exonérations fiscales à l'importation des batteries,https://news.google.com./articles/CBMib2h0dHBzOi8vYWZyaXF1ZWl0bmV3cy5jb20vZmluYW5jZS92ZWhpY3VsZXMtZWxlY3RyaXF1ZXMtdG9nby1ldGVuZC1leG9uZXJhdGlvbnMtZmlzY2FsZXMtaW1wb3J0YXRpb24tYmF0dGVyaWVzL9IBAA?hl=fr&gl=MA&ceid=MA%3Afr
Importation de panneaux en bois revêtus : le quota fixé,https://news.google.com./articles/CBMiXWh0dHBzOi8vd3d3LmxlY29ub21pc3RlLmNvbS9mbGFzaC1pbmZvcy9pbXBvcnRhdGlvbi1kZS1wYW5uZWF1eC1lbi1ib2lzLXJldmV0dXMtbGUtcXVvdGEtZml4ZdIBAA?hl=fr&gl=MA&ceid=MA%3Afr
"Blé: en novembre, le Maroc a presque triplé ses importations en provenance de la Russie",https://news.google.com./articles/CBMijgFodHRwczovL2ZyLmxlMzYwLm1hL2Vjb25vbWllL2JsZS1lbi1ub3ZlbWJyZS1sZS1tYXJvYy1hLXByZXNxdWUtdHJpcGxlLXNlcy1pbXBvcnRhdGlvbnMtZW4tcHJvdmVuYW5jZS1kZS1sYS1ydXNzaWVfUEVJVUE0TjdGWkFOWFBHNjdTNlA0Tlk2UzQv0gEA?hl=fr&gl=MA&ceid=MA%3Afr
Droits d'importation sur les tôles laminées : une augmentation préventive avant tout,https://news.google.com./articles/CBMie2h0dHBzOi8vbGVzZWNvLm1hL21hcm9jL2Ryb2l0cy1kaW1wb3J0YXRpb24tc3VyLWxlcy10b2xlcy1sYW1pbmVlcy11bmUtYXVnbWVudGF0aW9uLXByZXZlbnRpdmUtYXZhbnQtdG91dC5odG1sP1ByZW1pdW09dHJ1ZdIBAA?hl=fr&gl=MA&ceid=MA%3Afr
« Ker'Oman ce n'est pas importer du poisson par avion à Lorient ! »,https://news.google.com./articles/CBMicmh0dHBzOi8vd3d3LmZyYW5jZWxpdmUuZnIvdGVhc2VyL291ZXN0LWZyYW5jZS9rZXJvbWFuLWNlLW5lc3QtcGFzLWltcG9ydGVyLWR1LXBvaXNzb24tcGFyLWF2aW9uLWEtbG9yaWVudC04MzUyNzU4L9IBAA?hl=fr&gl=MA&ceid=MA%3Afr
Sécurité Alimentaire : Le Maroc prévoit d'importer 2 millions de tonnes de blé tendre,https://news.google.com./articles/CBMid2h0dHBzOi8vd3d3LmxvcGluaW9uLm1hL1NlY3VyaXRlLUFsaW1lbnRhaXJlLUxlLU1hcm9jLXByZXZvaXQtZC1pbXBvcnRlci0yLW1pbGxpb25zLWRlLXRvbm5lcy1kZS1ibGUtdGVuZHJlX2E0NDQ3OS5odG1s0gEA?hl=fr&gl=MA&ceid=MA%3Afr
Avocat : Les importations marocaines devraient enregistrer un nouveau record en 2023,https://news.google.com./articles/CBMiaWh0dHBzOi8vbGVtYXRpbi5tYS9lY29ub21pZS9sZXMtaW1wb3J0YXRpb25zLWRhdm9jYXRzLWF0dGVpZ25lbnQtMTM1MDAtdG9ubmVzLWEtZmluLXNlcHRlbWJyZS0yMDIzLzIwMzM2MdIBbWh0dHBzOi8vbGVtYXRpbi5tYS9lY29ub21pZS9sZXMtaW1wb3J0YXRpb25zLWRhdm9jYXRzLWF0dGVpZ25lbnQtMTM1MDAtdG9ubmVzLWEtZmluLXNlcHRlbWJyZS0yMDIzLzIwMzM2MS9hbXA?hl=fr&gl=MA&ceid=MA%3Afr
Céréales: le Maroc instaure une nouvelle prime forfaitaire pour l'importation de 2 millions de tonnes de blé,https://news.google.com./articles/CBMinAFodHRwczovL2ZyLmxlMzYwLm1hL2Vjb25vbWllL2NlcmVhbGVzLWxlLW1hcm9jLWluc3RhdXJlLXVuZS1ub3V2ZWxsZS1wcmltZS1mb3JmYWl0YWlyZS1wb3VyLWxpbXBvcnRhdGlvbi1kZS0yLW1pbGxpb25zLWRlLXRvbm5lc19MUVhJUURZWEpaQ05KR05DRUhTN0Y3M0pNNC_SAQA?hl=fr&gl=MA&ceid=MA%3Afr
Il sera bientôt interdit d'importer des trophées de chasse d'espèces menacées,https://news.google.com./articles/CBMimgFodHRwczovL3d3dy5kaG5ldC5iZS9kZXJuaWVyZXMtZGVwZWNoZXMvMjAyNC8wMS8wOS9pbC1zZXJhLWJpZW50b3QtaW50ZXJkaXQtZGltcG9ydGVyLWRlcy10cm9waGVlcy1kZS1jaGFzc2UtZGVzcGVjZXMtbWVuYWNlZXMtV09aUkFURFg0WkFHQlAyN09NWERVTE9RR1Ev0gGpAWh0dHBzOi8vd3d3LmRobmV0LmJlL2Rlcm5pZXJlcy1kZXBlY2hlcy8yMDI0LzAxLzA5L2lsLXNlcmEtYmllbnRvdC1pbnRlcmRpdC1kaW1wb3J0ZXItZGVzLXRyb3BoZWVzLWRlLWNoYXNzZS1kZXNwZWNlcy1tZW5hY2Vlcy1XT1pSQVREWDRaQUdCUDI3T01YRFVMT1FHUS8_b3V0cHV0VHlwZT1hbXA?hl=fr&gl=MA&ceid=MA%3Afr
Médicaments: le gouvernement acte une nouvelle baisse des droits d'importation,https://news.google.com./articles/CBMihQFodHRwczovL2ZyLmxlMzYwLm1hL2Vjb25vbWllL21lZGljYW1lbnRzLWxlLWdvdXZlcm5lbWVudC1hY3RlLXVuZS1ub3V2ZWxsZS1iYWlzc2UtZGVzLWRyb2l0cy1kaW1wb3J0YXRpb25fUU5LSlg3WVZFUkNGWktGR0RCQlhDNEg2SkEv0gEA?hl=fr&gl=MA&ceid=MA%3Afr
Chambre des représentants/PLF-2024 : réduire progressivement les droits d'importation sur les produits de ...,https://news.google.com./articles/CBMivQFodHRwczovLzJtLm1hL2ZyL25ld3MvQ2hhbWJyZS1kZXMtcmVwciVDMyVBOXNlbnRhbnRzLVBMRi0yMDI0LXIlQzMlQTlkdWlyZS1wcm9ncmVzc2l2ZW1lbnQtbGVzLWRyb2l0cy1kLWltcG9ydGF0aW9uLXN1ci1sZXMtcHJvZHVpdHMtZGUtY29uc29tbWF0aW9uLW1hJUMzJUFFdHJlLW1vdC1kZXMtYW1lbmRlbWVudHMtMjAyMzExMTDSAQA?hl=fr&gl=MA&ceid=MA%3Afr
Filière des viandes rouges : Qu'est-ce qui retarde l'importation des bovins ?,https://news.google.com./articles/CBMibWh0dHBzOi8vd3d3LmxvcGluaW9uLm1hL0ZpbGllcmUtZGVzLXZpYW5kZXMtcm91Z2VzLVF1LWVzdC1jZS1xdWktcmV0YXJkZS1sLWltcG9ydGF0aW9uLWRlcy1ib3ZpbnNfYTQ1Njk3Lmh0bWzSAQA?hl=fr&gl=MA&ceid=MA%3Afr
PLF 2024/Révision des droits d'importation : les importateurs de thé vert conditionné boivent la tasse !,https://news.google.com./articles/CBMijQFodHRwczovL2xlc2Vjby5tYS9tYXJvYy9wbGYtMjAyNC1yZXZpc2lvbi1kZXMtZHJvaXRzLWRpbXBvcnRhdGlvbi1sZXMtaW1wb3J0YXRldXJzLWRlLXRoZS12ZXJ0LWNvbmRpdGlvbm5lLWJvaXZlbnQtbGEtdGFzc2UuaHRtbD9QcmVtaXVtPXRydWXSAQA?hl=fr&gl=MA&ceid=MA%3Afr
Autoliquidation de la TVA à l'importation : quelques ajustements - MyActu par la Revue Fiduciaire,https://news.google.com./articles/CBMicWh0dHBzOi8vd3d3LnJldnVlLWZpZHVjaWFpcmUuY29tL2FjdHVhbGl0ZS9hcnRpY2xlL2F1dG9saXF1aWRhdGlvbi1kZS1sYS10dmEtYS1sLWltcG9ydGF0aW9uLXF1ZWxxdWVzLWFqdXN0ZW1lbnRz0gEA?hl=fr&gl=MA&ceid=MA%3Afr
Amendements PLF 2024 : les Conseillers réduisent le droit d'importation sur les smartphones,https://news.google.com./articles/CBMifWh0dHBzOi8vd3d3LmxvcGluaW9uLm1hL0FtZW5kZW1lbnRzLVBMRi0yMDI0LWxlcy1Db25zZWlsbGVycy1yZWR1aXNlbnQtbGUtZHJvaXQtZC1pbXBvcnRhdGlvbi1zdXItbGVzLXNtYXJ0cGhvbmVzX2E0NzIxNS5odG1s0gEA?hl=fr&gl=MA&ceid=MA%3Afr
PLF 2024: le droit d'importation des cigarettes électroniques jetables augmenté à 40 %,https://news.google.com./articles/CBMib2h0dHBzOi8vbGVkZXNrLm1hL2VuY29udGludS9wbGYtMjAyNC1sZS1kcm9pdC1kaW1wb3J0YXRpb24tZGVzLWNpZ2FyZXR0ZXMtZWxlY3Ryb25pcXVlcy1qZXRhYmxlcy1hdWdtZW50ZS1hLTQwL9IBAA?hl=fr&gl=MA&ceid=MA%3Afr
"Céréales A partir de ce 1er octobre, le Maroc compte importer 2 Mt de blé tendre à fin 2023",https://news.google.com./articles/CBMibmh0dHBzOi8vbGVkZXNrLm1hL2VuY29udGludS9hLXBhcnRpci1kZS1jZS0xZXItb2N0b2JyZS1sZS1tYXJvYy1jb21wdGUtaW1wb3J0ZXItMi1tdC1kZS1ibGUtdGVuZHJlLWEtZmluLTIwMjMv0gEA?hl=fr&gl=MA&ceid=MA%3Afr
Céréales : Importation de 256.013 tonnes de blé tendre,https://news.google.com./articles/CBMiWGh0dHBzOi8vd3d3LmxvcGluaW9uLm1hL0NlcmVhbGVzLUltcG9ydGF0aW9uLWRlLTI1Ni0wMTMtdG9ubmVzLWRlLWJsZS10ZW5kcmVfYTQ2MjI3Lmh0bWzSAQA?hl=fr&gl=MA&ceid=MA%3Afr
Autoroute hydrique Sebou-Bouregreg: le gouvernement suspend les droits d'importation sur certains tubes et tuyaux ...,https://news.google.com./articles/CBMimwFodHRwczovL2ZyLmxlMzYwLm1hL2Vjb25vbWllL2F1dG9yb3V0ZS1oeWRyaXF1ZS1zZWJvdS1ib3VyZWdyZWctbGUtZ291dmVybmVtZW50LXN1c3BlbmQtbGVzLWRyb2l0cy1kaW1wb3J0YXRpb24tZGVzLWFxdWVkdWNzLWVuX0daRzJLUk1UWE5GWlhEQ1YySVRUUFhVREFRL9IBAA?hl=fr&gl=MA&ceid=MA%3Afr
Le Maroc veut décupler ses importations d'ovins roumains en 2024,https://news.google.com./articles/CBMiZGh0dHBzOi8vd3d3LmxvcGluaW9uLm1hL0xlLU1hcm9jLXZldXQtZGVjdXBsZXItc2VzLWltcG9ydGF0aW9ucy1kLW92aW5zLXJvdW1haW5zLWVuLTIwMjRfYTQ2ODc4Lmh0bWzSAQA?hl=fr&gl=MA&ceid=MA%3Afr
La FDA autorise la Floride à importer des médicaments du Canada,https://news.google.com./articles/CBMiU2h0dHBzOi8vaWNpLnJhZGlvLWNhbmFkYS5jYS9ub3V2ZWxsZS8yMDM5MzI0L2ltcG9ydGF0aW9uLW1lZGljYW1lbnRzLWZsb3JpZGUtY2FuYWRh0gEA?hl=fr&gl=MA&ceid=MA%3Afr
Importation de blé tendre : le système de restitution à nouveau instauré,https://news.google.com./articles/CBMiY2h0dHBzOi8vbGVzZWNvLm1hL21hcm9jL2ltcG9ydGF0aW9uLWRlLWJsZS10ZW5kcmUtbGUtc3lzdGVtZS1kZS1yZXN0aXR1dGlvbi1hLW5vdXZlYXUtaW5zdGF1cmUuaHRtbNIBAA?hl=fr&gl=MA&ceid=MA%3Afr
Digitalisation des procédures d'importation de médicaments au Maroc: bien... mais peut mieux faire,https://news.google.com./articles/CBMilgFodHRwczovL2ZyLmxlMzYwLm1hL2Vjb25vbWllL2RpZ2l0YWxpc2F0aW9uLWRlcy1wcm9jZWR1cmVzLWRpbXBvcnRhdGlvbi1kZS1tZWRpY2FtZW50cy1hdS1tYXJvYy1iaWVuLW1haXMtcGV1dC1taWV1eC1mYWlyZV81VUMyNFRCTk5WQko3S01YMjJWMjIzSEVXSS_SAQA?hl=fr&gl=MA&ceid=MA%3Afr
"Céréales: le Maroc instaure une prime forfaitaire pour encourager l'importation de 2,5 millions de tonnes de blé",https://news.google.com./articles/CBMimAFodHRwczovL2ZyLmxlMzYwLm1hL2Vjb25vbWllL2NlcmVhbGVzLWxlLW1hcm9jLWluc3RhdXJlLXVuZS1wcmltZS1mb3JmYWl0YWlyZS1wb3VyLWVuY291cmFnZXItbGltcG9ydGF0aW9uLWRlLTI1LW1pbGxpb25zLWRlX1JIV1dKTVVXN05EVkREQVNQQTY0RlVBTlBBL9IBAA?hl=fr&gl=MA&ceid=MA%3Afr
Importation des sources de rayonnements ionisants: PortNet lance un nouveau service en ligne,https://news.google.com./articles/CBMiaWh0dHBzOi8vbGVtYXRpbi5tYS9lY29ub21pZS9zb3VyY2VzLWRlLXJheW9ubmVtZW50cy1pb25pc2FudHMtbGltcG9ydGF0aW9uLWRpZ2l0YWxpc2VlLXZpYS1wb3J0bmV0LzE5ODUzMtIBbWh0dHBzOi8vbGVtYXRpbi5tYS9lY29ub21pZS9zb3VyY2VzLWRlLXJheW9ubmVtZW50cy1pb25pc2FudHMtbGltcG9ydGF0aW9uLWRpZ2l0YWxpc2VlLXZpYS1wb3J0bmV0LzE5ODUzMi9hbXA?hl=fr&gl=MA&ceid=MA%3Afr
L'importation de bovins brésiliens au Maroc : Controverse suite à un rodéo citadin,https://news.google.com./articles/CBMiUGh0dHBzOi8vd3d3Lm1hcm9jLWhlYmRvLnByZXNzLm1hL2ltcG9ydGF0aW9uLWJvdmlucy1icmVzaWxpZW5zLW1hcm9jLWNvbnRyb3ZlcnNl0gEA?hl=fr&gl=MA&ceid=MA%3Afr
Le Maroc prolonge sa campagne d'importation de blé de janvier à avril,https://news.google.com./articles/CBMiZ2h0dHBzOi8vbGVtYXRpbi5tYS9lY29ub21pZS9sZS1tYXJvYy1wcm9sb25nZS1zYS1jYW1wYWduZS1kaW1wb3J0YXRpb24tZGUtYmxlLWRlLWphbnZpZXItYS1hdnJpbC8yMDI3OTfSAWtodHRwczovL2xlbWF0aW4ubWEvZWNvbm9taWUvbGUtbWFyb2MtcHJvbG9uZ2Utc2EtY2FtcGFnbmUtZGltcG9ydGF0aW9uLWRlLWJsZS1kZS1qYW52aWVyLWEtYXZyaWwvMjAyNzk3L2FtcA?hl=fr&gl=MA&ceid=MA%3Afr
Fruits secs: record historique des importations en 2023,https://news.google.com./articles/CBMiH2h0dHBzOi8vY29uc29uZXdzLm1hLzUyNTMzLmh0bWzSASNodHRwczovL2NvbnNvbmV3cy5tYS81MjUzMy5odG1sL2FtcA?hl=fr&gl=MA&ceid=MA%3Afr
PLF 2024/Redevances d'importation : une problématique de double imposition résolue,https://news.google.com./articles/CBMieWh0dHBzOi8vbGVzZWNvLm1hL21hcm9jL3BsZi0yMDI0LXJlZGV2YW5jZXMtZGltcG9ydGF0aW9uLXVuZS1wcm9ibGVtYXRpcXVlLWRlLWRvdWJsZS1pbXBvc2l0aW9uLXJlc29sdWUuaHRtbD9QcmVtaXVtPXRydWXSAQA?hl=fr&gl=MA&ceid=MA%3Afr
Secteur laitier : Hausse de la subvention à l'importation de vaches laitières,https://news.google.com./articles/CBMiamh0dHBzOi8vbWFyb2MtZGlwbG9tYXRpcXVlLm5ldC9zZWN0ZXVyLWxhaXRpZXItaGF1c3NlLWRlLWxhLXN1YnZlbnRpb24tYS1saW1wb3J0YXRpb24tZGUtdmFjaGVzLWxhaXRpZXJlcy_SAQA?hl=fr&gl=MA&ceid=MA%3Afr
"Voici les conditions d'importation et d'exportation des semences, des plants et des produits de cannabis - Médias24",https://news.google.com./articles/CBMihgFodHRwczovL21lZGlhczI0LmNvbS8yMDIzLzA0LzI2L3ZvaWNpLWxlcy1jb25kaXRpb25zLWRpbXBvcnRhdGlvbi1ldC1kZXhwb3J0YXRpb24tZGVzLXNlbWVuY2VzLWRlcy1wbGFudHMtZXQtZGVzLXByb2R1aXRzLWRlLWNhbm5hYmlzL9IBAA?hl=fr&gl=MA&ceid=MA%3Afr
Le Maroc reste contraint à importer sa viande rouge de l'étranger,https://news.google.com./articles/CBMieGh0dHBzOi8vbW9iaWxlLnRlbHF1ZWwubWEvaW5zdGFudC10LzIwMjMvMDcvMDYvbGUtbWFyb2MtcmVzdGUtY29udHJhaW50LWEtaW1wb3J0ZXItc2EtdmlhbmRlLXJvdWdlLWRlLWxldHJhbmdlcl8xODE5ODg5L9IBAA?hl=fr&gl=MA&ceid=MA%3Afr
"La Chine publie des quotas d'importation de brut pour 2024, 60% de plus que l'année précédente - commerce",https://news.google.com./articles/CBMirgFodHRwczovL3d3dy56b25lYm91cnNlLmNvbS9jb3Vycy9tYXRpZXJlLXByZW1pZXJlL1dUSS0yMzU1NjM5L2FjdHVhbGl0ZS9MYS1DaGluZS1wdWJsaWUtZGVzLXF1b3Rhcy1kLWltcG9ydGF0aW9uLWRlLWJydXQtcG91ci0yMDI0LTYwLWRlLXBsdXMtcXVlLWwtYW5uZWUtcHJlY2VkZW50ZS00NTY1NTg1Ny_SAQA?hl=fr&gl=MA&ceid=MA%3Afr
Les Suisses voteront pour interdire ou non l'importation de foie gras et de fourrure,https://news.google.com./articles/CBMilwFodHRwczovL3d3dy5iZm10di5jb20vZWNvbm9taWUvaW50ZXJuYXRpb25hbC9sZXMtc3Vpc3Nlcy12b3Rlcm9udC1wb3VyLWludGVyZGlycmUtb3Utbm9uLWwtaW1wb3J0YXRpb24tZGUtZm9pZS1ncmFzLWV0LWRlLWZvdXJydXJlX0FELTIwMjMxMjI4MDU2OS5odG1s0gGbAWh0dHBzOi8vd3d3LmJmbXR2LmNvbS9hbXAvZWNvbm9taWUvaW50ZXJuYXRpb25hbC9sZXMtc3Vpc3Nlcy12b3Rlcm9udC1wb3VyLWludGVyZGlycmUtb3Utbm9uLWwtaW1wb3J0YXRpb24tZGUtZm9pZS1ncmFzLWV0LWRlLWZvdXJydXJlX0FELTIwMjMxMjI4MDU2OS5odG1s?hl=fr&gl=MA&ceid=MA%3Afr
Import-export: la CCIS-CS organise un séminaire sur le rôle du port de Casablanca,https://news.google.com./articles/CBMieGh0dHBzOi8vd3d3LmxlY29ub21pc3RlLmNvbS9mbGFzaC1pbmZvcy9pbXBvcnQtZXhwb3J0LWxhLWNjaXMtY3Mtb3JnYW5pc2UtdW4tc2VtaW5haXJlLXN1ci1sZS1yb2xlLWR1LXBvcnQtZGUtY2FzYWJsYW5jYdIBAA?hl=fr&gl=MA&ceid=MA%3Afr
Blé tendre : l’ONICL subventionne l'importation de 20 Mqx jusqu'au 31 décembre,https://news.google.com./articles/CBMiZmh0dHBzOi8vbGVkZXNrLm1hL2VuY29udGludS9ibGUtdGVuZHJlLWxvbmljbC1zdWJ2ZW50aW9ubmUtbGltcG9ydGF0aW9uLWRlLTIwLW1xeC1qdXNxdWF1LTMxLWRlY2VtYnJlL9IBAA?hl=fr&gl=MA&ceid=MA%3Afr
Le Maroc réduit les droits d'importation sur certains médicaments pour renforcer l'industrie pharmaceutique,https://news.google.com./articles/CBMiiQFodHRwczovL21hcm9jLWRpcGxvbWF0aXF1ZS5uZXQvbGUtbWFyb2MtcmVkdWl0LWxlcy1kcm9pdHMtZGltcG9ydGF0aW9uLXN1ci1jZXJ0YWlucy1tZWRpY2FtZW50cy1wb3VyLXJlbmZvcmNlci1saW5kdXN0cmllLXBoYXJtYWNldXRpcXVlL9IBAA?hl=fr&gl=MA&ceid=MA%3Afr
"Importations : 200.000 dossiers traités en 2022, dont 2.434 de non-conformité",https://news.google.com./articles/CBMib2h0dHBzOi8vd3d3LmxhdmllZWNvLmNvbS9hdS1yb3lhdW1lL2ltcG9ydGF0aW9ucy0yMDAtMDAwLWRvc3NpZXJzLXRyYWl0ZXMtZW4tMjAyMi1kb250LTItNDM0LWRlLW5vbi1jb25mb3JtaXRlL9IBAA?hl=fr&gl=MA&ceid=MA%3Afr
L'importation de produits alimentaires | economie.gouv.fr,https://news.google.com./articles/CBMiQ2h0dHBzOi8vd3d3LmVjb25vbWllLmdvdXYuZnIvY2VkZWYvaW1wb3J0YXRpb24tZGVucmVlcy1hbGltZW50YWlyZXPSAQA?hl=fr&gl=MA&ceid=MA%3Afr
Réduction des droits d'importation des produits pharmaceutiques : le projet de décret adopté,https://news.google.com./articles/CBMie2h0dHBzOi8vd3d3LmxlY29ub21pc3RlLmNvbS9mbGFzaC1pbmZvcy9yZWR1Y3Rpb24tZGVzLWRyb2l0cy1kLWltcG9ydGF0aW9uLWRlcy1wcm9kdWl0cy1waGFybWFjZXV0aXF1ZXMtbGUtcHJvamV0LWRlLWRlY3JldNIBAA?hl=fr&gl=MA&ceid=MA%3Afr
Blé: le Maroc modifie son système de restitution pour encourager les importations depuis la Russie,https://news.google.com./articles/CBMimgFodHRwczovL2ZyLmxlMzYwLm1hL2Vjb25vbWllL2JsZS1sZS1tYXJvYy1tb2RpZmllLXNvbi1zeXN0ZW1lLWRlLXJlc3RpdHV0aW9uLXBvdXItZW5jb3VyYWdlci1sZXMtaW1wb3J0YXRpb25zLWRlcHVpcy1sYS1ydXNzaWVfR001SUtONTRTQkJaUEVFQVVZTFdYN1IyQ1Uv0gEA?hl=fr&gl=MA&ceid=MA%3Afr
"PLF 2024 Réduction du droit d'importation à 2,5% pour les tracteurs routiers pour semi-remorques électriques",https://news.google.com./articles/CBMifWh0dHBzOi8vbGVkZXNrLm1hL2VuY29udGludS9yZWR1Y3Rpb24tZHUtZHJvaXQtZGltcG9ydGF0aW9uLWEtMjUtcG91ci1sZXMtdHJhY3RldXJzLXJvdXRpZXJzLXBvdXItc2VtaS1yZW1vcnF1ZXMtZWxlY3RyaXF1ZXMv0gEA?hl=fr&gl=MA&ceid=MA%3Afr
"Aïd Al-Adha: les importations de moutons, vont-elles vraiment stabiliser les prix?",https://news.google.com./articles/CBMiiAFodHRwczovL2ZyLmxlMzYwLm1hL2Vjb25vbWllL2FpZC1hbC1hZGhhLWxlcy1pbXBvcnRhdGlvbnMtZGUtbW91dG9ucy12b250LWVsbGVzLXZyYWltZW50LXN0YWJpbGlzZXItbGVzLXByaXhfRlpQREJQSFNZWkE0VFBKRUdVRFFTSk1RTEkv0gEA?hl=fr&gl=MA&ceid=MA%3Afr
Entre l'AMSSNuR et PortNet : Tout un système digital pour l'importation des sources de rayonnements ionisants,https://news.google.com./articles/CBMiiAFodHRwczovL2F1am91cmRodWkubWEvZWNvbm9taWUvZW50cmUtbGFtc3NudXItZXQtcG9ydG5ldC10b3V0LXVuLXN5c3RlbWUtZGlnaXRhbC1wb3VyLWxpbXBvcnRhdGlvbi1kZXMtc291cmNlcy1kZS1yYXlvbm5lbWVudHMtaW9uaXNhbnRz0gEA?hl=fr&gl=MA&ceid=MA%3Afr
Avocats : les importations marocaines atteignent un record,https://news.google.com./articles/CBMiYGh0dHBzOi8vd3d3LmxlY29ub21pc3RlLmNvbS9mbGFzaC1pbmZvcy9hdm9jYXRzLWxlcy1pbXBvcnRhdGlvbnMtbWFyb2NhaW5lcy1hdHRlaWduZW50LXVuLXJlY29yZNIBAA?hl=fr&gl=MA&ceid=MA%3Afr
